id,seq,speaker,text,portrait
tuto_02,300,DEV,note 別都市に移動実行時、羊毛10個所持していない場合に発生,
tuto_02,305,マルク,羊毛が足りてないな。市場へ行こう。,res://ui/portraits/hero_01.png
tuto_02,310,DEV,note 羊毛10個所持時、Pilton以外に移動選択時に発生,
tuto_02,315,マルク,Piltonに羊毛を納品しなきゃね。,res://ui/portraits/hero_01.png
tuto_02,320,DEV,ctx_place Pilton,
tuto_02,325,DEV,note Pilton到着時に自動で発生,
tuto_02,330,受付,おかえりなさい、マルクさん。,res://ui/portraits/clerk_01.png
tuto_02,335,受付,ご無事で何よりです。,res://ui/portraits/clerk_01.png
tuto_02,340,受付,依頼の羊毛は揃えられましたか？,res://ui/portraits/clerk_01.png
tuto_02,345,システム,羊毛10個を納品した！,
tuto_02,350,受付,はい、確かに。,res://ui/portraits/clerk_01.png
tuto_02,355,受付,ありがとうございます。バッチリです！,res://ui/portraits/clerk_01.png
tuto_02,360,受付,では、こちらが依頼の報酬になります。,res://ui/portraits/clerk_01.png
tuto_02,365,システム,報酬○○を受け取った！,
tuto_02,370,システム,Pilton地区の『信用』が少し上がった！,
tuto_02,375,受付,都市の外に出る以上どうしても危険が伴ってしまいます。,res://ui/portraits/clerk_01.png
tuto_02,380,受付,備えよ常に、です！,res://ui/portraits/clerk_01.png
tuto_02,385,受付,……これはギルド長の口癖ですけどね。,res://ui/portraits/clerk_01.png
tuto_02,390,受付,それでは今回もお疲れ様でした。,res://ui/portraits/clerk_01.png
tuto_02,395,受付,次の研修もご用意していますので,res://ui/portraits/clerk_01.png
tuto_02,400,受付,準備が出来たらまたギルドの依頼を受注してくださいね。,res://ui/portraits/clerk_01.png
tuto_03,5,DEV,ctx_place Pilton,
tuto_03,10,DEV,note 依頼から「ギルドの依頼」を選択すると発生,
tuto_03,15,受付,では、次の研修に進みましょう。,res://ui/portraits/clerk_01.png
tuto_03,20,受付,ここまでで、配達と移動、それからリスクと護衛は体験できました。,res://ui/portraits/clerk_01.png
tuto_03,25,受付,次は……商人として一番大事なこと。,res://ui/portraits/clerk_01.png
tuto_03,30,受付,『稼ぎ方』そのものを覚えてもらいます。,res://ui/portraits/clerk_01.png
tuto_03,35,受付,依頼をこなすのは町のため、自身の信用のためにも大切なことですが,res://ui/portraits/clerk_01.png
tuto_03,40,受付,それだけが商人の仕事ではありません。,res://ui/portraits/clerk_01.png
tuto_03,45,受付,相場を見て『売買』することで利益を作れるようにならないといけません。,res://ui/portraits/clerk_01.png
tuto_03,50,受付,でも経験のないうちは何をどう買えばいいのか分からないですよね。,res://ui/portraits/clerk_01.png
tuto_03,55,受付,そこで活用していただきたいのが、ギルドが発行している『週報』です。,res://ui/portraits/clerk_01.png
tuto_03,60,受付,各地の支部が集めた情報をまとめていて、簡易的な相場確認が出来るんです。,res://ui/portraits/clerk_01.png
tuto_03,65,受付,実際にどんな情報が確認できるのか見てみましょうか。,res://ui/portraits/clerk_01.png
tuto_03,70,DEV,note ここで週報ウィンドウが自動で開く（チュートリアル用に強制表示）,
tuto_03,75,受付,週報には、大きく3つの見出しがあります。,res://ui/portraits/clerk_01.png
tuto_03,80,受付,『上昇』は値上がりしている品です。手持ちなら売り時、これから買うなら慎重に。,res://ui/portraits/clerk_01.png
tuto_03,85,受付,『下落』は値下がりしている品。安く買える可能性が高いです。,res://ui/portraits/clerk_01.png
tuto_03,90,受付,そして『注目』は、品薄になりそうだったり、急に動きそうな品です。,res://ui/portraits/clerk_01.png
tuto_03,95,受付,今はそんなに難しく考えなくて大丈夫です。,res://ui/portraits/clerk_01.png
tuto_03,100,受付,最初は『下落で買って、上昇で売る』。,res://ui/portraits/clerk_01.png
tuto_03,105,受付,これだけでも、商売らしくなりますから。,res://ui/portraits/clerk_01.png
tuto_03,110,受付,ただし週報は、1週間前の情報になります。,res://ui/portraits/clerk_01.png
tuto_03,115,受付,どうしても各地から情報を集めてまとめるのに時間がかかってしまうので……。,res://ui/portraits/clerk_01.png
tuto_03,120,受付,現在の相場とのズレがあるかもしれないことに注意してください。,res://ui/portraits/clerk_01.png
tuto_03,125,受付,ちなみに週報は、Pilton地区の都市であれば,res://ui/portraits/clerk_01.png
tuto_03,130,受付,どこにいても後から確認できますよ。,res://ui/portraits/clerk_01.png
tuto_03,135,受付,今回の研修課題はシンプルに,res://ui/portraits/clerk_01.png
tuto_03,140,受付,週報の情報を参考にして、利益を出すことです。,res://ui/portraits/clerk_01.png
tuto_03,145,受付,目標は……そうですね。,res://ui/portraits/clerk_01.png
tuto_03,150,受付,所持金を、いまより○○だけ増やして戻ってきてください。,res://ui/portraits/clerk_01.png
tuto_03,155,受付,ただし、今までの研修でも感じていると思いますが,res://ui/portraits/clerk_01.png
tuto_03,160,受付,利益は『売値−買値』だけじゃありません。,res://ui/portraits/clerk_01.png
tuto_03,165,受付,移動費、通行税、関税、護衛費……,res://ui/portraits/clerk_01.png
tuto_03,170,受付,そういったコストを引いた残りが利益になりますからね。,res://ui/portraits/clerk_01.png
tuto_03,175,受付,もし元手が心もとないと感じるようであれば,res://ui/portraits/clerk_01.png
tuto_03,180,受付,地道に町の依頼をこなすことで余裕が作れると思いますよ。,res://ui/portraits/clerk_01.png
tuto_03,185,受付,信用も得られることですし、,res://ui/portraits/clerk_01.png
tuto_03,190,受付,自分に出来そうな依頼は積極的に受けてみることをオススメします。,res://ui/portraits/clerk_01.png
tuto_03,195,受付,いきなり難しくなったと感じるかもしれませんが,res://ui/portraits/clerk_01.png
tuto_03,200,受付,商人になる以上、避けては通れません。がんばりましょう！,res://ui/portraits/clerk_01.png
